,id,category,text,polarity,trans_text
102,105,taste,"어복쟁반 포장해서 먹었는데, 괜찮았어요~~
부모님도 맛나게 드셨구요!
가격이 좀 비싼편이지만 테이크아웃해서
집에서 먹기 참 좋네요 :)",1,"I packed the fish cake tray and ate it, and it was good. My parents enjoyed the meal! It's a bit expensive, but it's taken out. Very nice to eat at home :)"
103,106,taste,맛있어요!,1,It's good!
104,107,taste,평양냉면 맛있어여,1,Pyeongyang naengmyeon is delicious
105,108,taste,맛있어요,1,It's good
106,109,taste,"분당 찐맛집
어복쟁반 넘 맛있어요",1,A steamed bun restaurant. Eobok Tray is so good
107,110,taste,맛은 있는데 가격이 넘 올랐네요 ㅠㅠ,1,"It's delicious, but the price has gone up"
108,111,taste,어복쟁반이 국물이 깔끔하고 맛있어요.,1,Eobok Tray's soup is clean and delicious.
109,112,taste,"물냉 비냉 먹었는데 물냉이 더 맛있네요.
김치도 깔끔하고 김칫국이랑 피클도 맛있네요.",1,"I ate mulnaengmyeon and binaengmyeon, but mulnaengmyeon tastes better.. The kimchi is clean and the kimchi soup and pickles are delicious."
110,114,taste,"맛있어요, 김치는 국내산^^",1,"It's delicious, kimchi is made in Korea^^"
111,115,taste,맛있어서 자주가요 맛있어,1,I go there often because it's good. It's good
112,116,taste,"평양식 냉면, 어복쟁반, 만두전골, 불고기, 녹두지짐 조금 비싸긴 한데, 다 맛있어요.",1,"Pyeongyang-style cold noodles, Eobok tray, dumpling hot pot, bulgogi, mung bean paste stew are a little expensive, but they are all delicious."
113,117,taste,일주일 안에 세번 방문포장 했어요ㅋㅋㅋ 온반 양도 많고 너무 맛있어요 ㅎㅎ 저희집은 양이 많지 않아서 1개 사면 네식구가 먹어요 ㅎㅎㅎ,1,"Three times in a weekThere's a lot of onban and it's so good My family doesn't have a lot, so if you buy one, your family will eat it Hahaha"
114,118,taste,맛있어요,1,It's good
115,119,taste,항상 맛있게 먹는 집~,1,The restaurant that always eats deliciously
116,120,taste,"만두전골,어복쟁반 ,냉면추천이요",1,"Dumpling hot pot, fish cake tray, and cold noodles"
117,121,taste,"만두전골 먹으러 갔는데 진짜 맛있어요.
셋이서 전골 2인분에 녹두전 주문해서 먹었는데 전골 양이 푸짐해서 배부르게 먹었어요.
만두전골에 들어가는 고기도 좋은거같고 국물도 깔끔해서 자주 먹으러 갈거 같아요",1,"I went to eat dumpling hot pot and it was really good.. The three of us ordered two servings of hot pot and mung bean pancake, but the amount of hot pot was large, so we ate it full.. I think the meat in dumpling hot pot is good and the soup is clean, so I think I'll go eat it often"
118,122,taste,맛있어요,1,It's good
119,123,taste,소고기온반 맛좋아요. 여의도 평가옥보다 낫네요,1,I like the taste of beef on the taste. It's better than Yeouido evaluation house
120,124,taste,맛있습니다,1,It is delicious.
121,125,taste,본점이라 더 맛있어요,1,It's more delicious because it's the main store
122,126,taste,"비오면 생각나는 맛! 슴슴해서 더 좋아요. 소고기와 토종닭 두 종류가 있는데 매번 토종닭만 먹는 중. 닭고기가 쫄깃해서 맛있어요?
온반 한 그릇에 만두 하나 전 하나 그리고 닭고기와 버섯, 야채, 당면 정도가 들어있어서 
성인 남성 두 분이서 오셨다면 빈대떡도 시켜드셔야 배찰 것 같아요.
단골도 많고 보통 다들 여럿이서 오셔서, 혼밥 난이도 조금 높은 집ㅠㅠ(이지만 가능합니당 흐흐)",1,"The taste that comes to mind when it rains! I like it more because I'm hesitant. There are two kinds of beef and native chicken, but I only eat native chicken every time. Is it delicious because the chicken is chewy? A bowl of hot rice contains one dumpling, one pancake, chicken, mushrooms, vegetables, and glass noodles. If there are two adult men here, I think you need to order mung bean pancake to get full.. There are a lot of regulars and usually a lot of people come, so the difficulty of eating alone is a little high. (But it's"
123,127,taste,정말 맛있습니다! 오랜만에 찾아갔는데도 예전에 먹던 그 맛 그대로네요 :),1,"It's really good! It's been a while since I visited, but it still tastes the same as before :)"
124,128,taste,오복쟁반 평양냉면 맛있게 잘 먹었습니다,1,Thank you for the Pyeongyang Cold Noodles
125,129,taste,맛있어요,1,It's good
126,130,taste,"평양 냉면과 만두전골, 편육을 먹었어요. 맛있습니다.",1,"I ate Pyeongyang naengmyeon, dumpling hot pot, and Pyeonyuk. It is delicious."
127,131,taste,맛있어요,1,It's good
128,132,taste,늘 그 맛으로 변함 없는 맛집,1,A restaurant that never changes with its taste
129,133,taste,어복쟁반 맛있어요,1,Eobok Tray is good
130,134,taste,맛있어요,1,It's good
131,135,taste,약간 짠 맛이 있지만 먹을만 해요,1,"It's a bit salty, but it's okay to eat"
132,136,taste,사장님이 되게 띠꺼워하면서 주문받고 계산하고 응대하셔서 부모님 모시고 가서 좀 그랫네요 ㅋㅋㅋㅋ 음식은 맛있는데 서비스는 그 질을 못 따라가요 싫어하는 친구가 밥사준다고 할 때 가세요 ㅋㅋㅋ,1,"The boss was really annoyed and took the order, paid, and responded, so I took my parents with me. The food was delicious, but the service couldn't keep up with the quality Go when a friend you don't like buys you food LOL"
133,137,taste,존맛탱 평양냉면 녹두전 짱,1,Pyeongyang naengmyeon mung bean pancake is the best
134,138,taste,맛있어요 좋아요 굿이에요~',1,It's good. It's good
135,139,taste,맛있어요.,1,It's good.
136,140,taste,맛있어요! 부드럽고 좋아요,1,It's good! It's soft and nice
137,141,taste,맛좋고 깔끔함,1,Delicious and clean
138,142,taste,"평냉은 여기가 최고!!어복쟁반도 끝내줘요!
다른지점보다 여기가 최고맛나요!",1,"Pyeongnaengmyeon is the best here!!It's a great deal, too! This place tastes better than other places!"
139,143,taste,평양냉면 넘 맛있어요~^^,1,Pyeongyang naengmyeon is so good^^
140,144,taste,맛나게 잘 먹었어요! 가격대가 좀 있는 편이라 자주오긴 어려울 것 같습니다 ㅎㅎ,1,"Thank you for the delicious meal! It's a bit expensive, so I don't think I can come often Haha"
141,145,taste,평양냉면은 내 입맛에 안맞는듯..ㅠ.ㅠ,0,Pyeongyang naengmyeon doesn't seem to suit my taste.ㅠ
142,146,taste,",맛나요~ 잘먹고 갑니다",1,It's delicious. Thank you for the food
143,147,taste,"#파전(녹두지지미)
#쇠고기육개장
너무맛있어요
#가격도저렴
",1,"#Green onion pancake. #Beefyukgaejang. It's so good. #It's cheap, too."
144,148,taste,처음 먹어보는 평양냉면이었는데 제입맛엔 되게 좋았어요!! 글구 녹두전?도 있는데 크기 진짜 크고 엄청 맛있어요ㅜㅜ또 먹으러가고싶네용 ,1,"It was my first time eating Pyeongyang naengmyeon, and it was really good to my taste!! There's also mung bean pancake. It's really big and deliciousI want to go eat againDragon"
145,149,taste,여기음식맛있네요,1,The food here is good
146,150,taste,이북의 맛. 가격이 조금 비싸지만 그만큼 양이 많습니다. 만두는 속이 꽉 차 있어 충분히 배부릅니다.,1,"The taste of North Korea. It's a little expensive, but it's a lot. Dumplings are full and full enough."
147,151,taste,맛있어요,1,It's good
148,152,taste,맛나요 평냉 짱,1,It's delicious. Pyeongyang naengmyeon is the best
149,153,taste,맛나요,1,It's delicious
150,154,taste,맛있어요,1,It's good
151,155,taste,맛있어요,1,It's good
152,156,taste,슴슴한 평양냉면에 빠져드는 맛집,1,A restaurant that makes you fall in love with Pyeongyang naengmyeon
153,157,taste,평양냉면 실망이었습니다 ㅜ,0,I was disappointed with Pyeongyang naengmyeon was disappointing ㅜ
154,158,taste,"담백한 맛이 일품이네요
가족들이랑 즐겁게 먹었습니다. 강추해요~",1,The light taste is excellent. I enjoyed eating with my family. I strongly recommend it
155,159,taste,맛있는데 가격은 부담이네요,1,"It's good, but the price is too much"
